{
  "schema": "anto-ltg.proposals/1",
  "adapter": "winget-index",
  "generated_at": "2026-10-13T07:54:19.029Z",
  "source": {
    "id": "winget-pkgs",
    "repo": "microsoft/winget-pkgs",
    "ref": "master",
    "commit": "499f134fea1c2726098cf8e6bc3caab8f5707ef5"
  },
  "proposals": [],
  "errors": []
}
